<?xml version="1.0"?>
<!--
  Copyright (c) 2000, 2024, Oracle and/or its affiliates.

  Licensed under the Universal Permissive License v 1.0 as shown at
  https://oss.oracle.com/licenses/upl.
  -->
<pof-config xmlns:xsi="http://www.w3.org/2001/XMLSchema-instance"
            xmlns="http://xmlns.oracle.com/coherence/coherence-pof-config"
            xsi:schemaLocation="http://xmlns.oracle.com/coherence/coherence-pof-config coherence-pof-config.xsd">        
  <user-type-list>
    <include>coherence-pof-config.xml</include>

    <user-type>
      <type-id>1000</type-id>
      <class-name>data.Person</class-name>
    </user-type>

    <user-type>
      <type-id>1001</type-id>
      <class-name>data.Person$Key</class-name>
    </user-type>

    <user-type>
      <type-id>1003</type-id>
      <class-name>data.pof.PortablePerson</class-name>
    </user-type>

    <user-type>
      <type-id>1004</type-id>
      <class-name>data.pof.Address</class-name>
    </user-type>

    <user-type>
      <type-id>1005</type-id>
      <class-name>data.pof.PhoneNumber</class-name>
    </user-type>

    <user-type>
      <type-id>1100</type-id>
      <class-name>com.oracle.coherence.testing.processors.HasIndexProcessor</class-name>
    </user-type>

    <user-type>
      <type-id>1101</type-id>
      <class-name>data.pof.PersonRecord</class-name>
      <serializer>
        <class-name>data.pof.PersonRecord$PofSerializer</class-name>
      </serializer>
    </user-type>

  </user-type-list>
</pof-config>
