<?xml version="1.0"?>
<!--
  Copyright (c) 2019, 2020, Oracle and/or its affiliates.

  Licensed under the Universal Permissive License v 1.0 as shown at
  http://oss.oracle.com/licenses/upl.
-->

<pof-config xmlns:xsi="http://www.w3.org/2001/XMLSchema-instance"
            xmlns="http://xmlns.oracle.com/coherence/coherence-pof-config"
            xsi:schemaLocation="http://xmlns.oracle.com/coherence/coherence-pof-config coherence-pof-config.xsd">
  <user-type-list>
    <!-- coherence POF user types -->
    <include>coherence-pof-config.xml</include>

    <!-- com.tangosol.examples package -->
    <user-type>
      <type-id>1001</type-id>
      <class-name>com.tangosol.examples.pof.ContactId</class-name>
    </user-type>
    <user-type>
      <type-id>1002</type-id>
      <class-name>com.tangosol.examples.pof.Contact</class-name>
    </user-type>
    <user-type>
      <type-id>1003</type-id>
      <class-name>com.tangosol.examples.pof.Address</class-name>
    </user-type>
    <user-type>
      <type-id>1004</type-id>
      <class-name>com.tangosol.examples.pof.PhoneNumber</class-name>
    </user-type>
  </user-type-list>

  <allow-interfaces>true</allow-interfaces>
  <allow-subclasses>true</allow-subclasses>
</pof-config>