<?xml version="1.0"?>
<!--
  Copyright (c) 2000, 2020, Oracle and/or its affiliates.

  Licensed under the Universal Permissive License v 1.0 as shown at
  http://oss.oracle.com/licenses/upl.
-->

<pof-config xmlns:xsi="http://www.w3.org/2001/XMLSchema-instance"
            xmlns="http://xmlns.oracle.com/coherence/coherence-pof-config"
            xsi:schemaLocation="http://xmlns.oracle.com/coherence/coherence-pof-config coherence-pof-config.xsd">        
  <user-type-list>
    <include>coherence-pof-config.xml</include>

    <user-type>
      <type-id>1000</type-id>
      <class-name>common.CaseInsensitiveComparator</class-name>
    </user-type>

    <user-type>
      <type-id>1001</type-id>
      <class-name>data.Person</class-name>
    </user-type>

    <user-type>
      <type-id>1002</type-id>
      <class-name>data.Person$Key</class-name>
    </user-type>

    <user-type>
      <type-id>1003</type-id>
      <class-name>data.Trade</class-name>
    </user-type>

  </user-type-list>
</pof-config>
