<?xml version="1.0"?>
<!--
  Copyright (c) 2000, 2022, Oracle and/or its affiliates.

  Licensed under the Universal Permissive License v 1.0 as shown at
  http://oss.oracle.com/licenses/upl.
-->

<pof-config xmlns:xsi="http://www.w3.org/2001/XMLSchema-instance"
            xmlns="http://xmlns.oracle.com/coherence/coherence-pof-config"
            xsi:schemaLocation="http://xmlns.oracle.com/coherence/coherence-pof-config coherence-pof-config.xsd">        
  <user-type-list>
    <user-type>
      <type-id>1001</type-id>
      <class-name>com.tangosol.io.pof.ConfigurablePofContextTest$PofChild</class-name>
    </user-type>
  </user-type-list>

  <allow-interfaces>true</allow-interfaces>
  <allow-subclasses>true</allow-subclasses>
  <default-serializer>
     <!-- not actually used. Just make sure that it gets instantiated as the serializer -->
     <class-name>com.tangosol.io.pof.ThrowablePofSerializer</class-name>
   </default-serializer>
</pof-config>